{
  "id": "MAT-CONCRETE-0002",
  "name": "Fine Concrete Slab",
  "category": "concrete",
  "subcategory": "fine_broomed_slab",
  "description": "Warm gray fine-aggregate concrete slab photographed outdoors.",
  "status": "prototype",
  "sourceType": "user_photograph",
  "sourceFiles": ["source/original-photo.jpg", "source/crop-source.jpg"],
  "license": "CC0-1.0",
  "provenance": { "creator": "user-provided photograph", "collectionMethod": "phone photograph", "sourcePhoto": "1-Photo-1.jpg", "licenseStatus": "confirmed_by_user" },
  "realWorldWidthMeters": 1,
  "realWorldHeightMeters": 1,
  "scaleStatus": "unverified",
  "pixelsPerMeter": 2048,
  "defaultRepeat": [1, 1],
  "mappingMethods": ["uv", "planar", "box", "triplanar"],
  "baseColorMap": "maps/base-color.jpg",
  "normalMap": null,
  "roughnessMap": null,
  "heightMap": null,
  "aoMap": null,
  "metalnessMap": null,
  "opacityMap": null,
  "roughness": 0.91,
  "metalness": 0,
  "normalStrength": 1,
  "heightStrength": 0.06,
  "displacementScale": 0,
  "colorSpace": "sRGB",
  "seamless": false,
  "tileabilityScore": 0.42,
  "physicalScaleValidated": false,
  "closeupValidated": false,
  "curvedSurfaceValidated": false,
  "verticalSurfaceValidated": false,
  "antiTilingEnabled": false,
  "variants": [],
  "tags": ["concrete", "slab", "fine-aggregate", "prototype"],
  "createdAt": "2026-08-01",
  "updatedAt": "2026-08-01"
}
