{
  "id": "MAT-CONCRETE-0005",
  "name": "Scored Concrete Pavers",
  "category": "concrete",
  "subcategory": "scored_paver_grid",
  "description": "Light scored concrete pavers with repeated grid joints and fine linear tooling.",
  "status": "prototype",
  "sourceType": "user_photograph",
  "sourceFiles": ["source/original-photo.jpg", "source/crop-source.jpg"],
  "license": "CC0-1.0",
  "provenance": { "creator": "user-provided photograph", "collectionMethod": "phone photograph", "sourcePhoto": "7-Photo-7.jpg", "licenseStatus": "confirmed_by_user" },
  "realWorldWidthMeters": 1,
  "realWorldHeightMeters": 1,
  "scaleStatus": "unverified",
  "pixelsPerMeter": 2048,
  "defaultRepeat": [1, 1],
  "mappingMethods": ["uv", "planar", "box", "triplanar"],
  "baseColorMap": "maps/base-color.jpg",
  "normalMap": null,
  "roughnessMap": null,
  "heightMap": null,
  "aoMap": null,
  "metalnessMap": null,
  "opacityMap": null,
  "roughness": 0.9,
  "metalness": 0,
  "normalStrength": 1,
  "heightStrength": 0.08,
  "displacementScale": 0,
  "colorSpace": "sRGB",
  "seamless": false,
  "tileabilityScore": 0.36,
  "physicalScaleValidated": false,
  "closeupValidated": false,
  "curvedSurfaceValidated": false,
  "verticalSurfaceValidated": false,
  "antiTilingEnabled": false,
  "variants": [],
  "tags": ["concrete", "pavers", "scored", "grid", "prototype"],
  "createdAt": "2026-08-01",
  "updatedAt": "2026-08-01"
}
