{
  "id": "MAT-FABRIC-0001",
  "name": "Gray Loop Carpet",
  "category": "fabric",
  "subcategory": "loop_pile_carpet",
  "description": "Gray loop-pile carpet with dense directional fiber variation and soft micro-relief.",
  "status": "prototype",
  "sourceType": "user_photograph",
  "sourceFiles": ["source/original-photo.jpg", "source/crop-source.jpg"],
  "license": "CC0-1.0",
  "provenance": { "creator": "user-provided photograph", "collectionMethod": "phone photograph", "sourcePhoto": "5-Photo-5.jpg", "licenseStatus": "confirmed_by_user" },
  "realWorldWidthMeters": 1,
  "realWorldHeightMeters": 1,
  "scaleStatus": "unverified",
  "pixelsPerMeter": 2048,
  "defaultRepeat": [1, 1],
  "mappingMethods": ["uv", "planar", "box", "triplanar"],
  "baseColorMap": "maps/base-color.jpg",
  "normalMap": null,
  "roughnessMap": null,
  "heightMap": null,
  "aoMap": null,
  "metalnessMap": null,
  "opacityMap": null,
  "roughness": 0.98,
  "metalness": 0,
  "normalStrength": 1,
  "heightStrength": 0.08,
  "displacementScale": 0,
  "colorSpace": "sRGB",
  "seamless": false,
  "tileabilityScore": 0.46,
  "physicalScaleValidated": false,
  "closeupValidated": false,
  "curvedSurfaceValidated": false,
  "verticalSurfaceValidated": false,
  "antiTilingEnabled": false,
  "variants": [],
  "tags": ["fabric", "carpet", "fiber", "interior", "prototype", "cc0"],
  "createdAt": "2026-08-01",
  "updatedAt": "2026-08-01"
}
