{
  "id": "MAT-ASPHALT-0003",
  "name": "Coarse Asphalt Aggregate",
  "category": "asphalt",
  "subcategory": "coarse_aggregate_closeup",
  "description": "Close-up coarse asphalt aggregate with pronounced relief and a small retained piece of organic debris.",
  "status": "prototype",
  "sourceType": "user_photograph",
  "sourceFiles": ["source/original-photo.jpg", "source/crop-source.jpg"],
  "license": "CC0-1.0",
  "provenance": { "creator": "user-provided photograph", "collectionMethod": "phone photograph", "sourcePhoto": "3-Photo-3.jpg", "licenseStatus": "confirmed_by_user" },
  "realWorldWidthMeters": 1,
  "realWorldHeightMeters": 1,
  "scaleStatus": "unverified",
  "pixelsPerMeter": 2048,
  "defaultRepeat": [1, 1],
  "mappingMethods": ["uv", "planar", "box", "triplanar"],
  "baseColorMap": "maps/base-color.jpg",
  "normalMap": null,
  "roughnessMap": null,
  "heightMap": null,
  "aoMap": null,
  "metalnessMap": null,
  "opacityMap": null,
  "roughness": 0.9,
  "metalness": 0,
  "normalStrength": 1,
  "heightStrength": 0.14,
  "displacementScale": 0,
  "colorSpace": "sRGB",
  "seamless": false,
  "tileabilityScore": 0.18,
  "physicalScaleValidated": false,
  "closeupValidated": false,
  "curvedSurfaceValidated": false,
  "verticalSurfaceValidated": false,
  "antiTilingEnabled": false,
  "variants": [],
  "tags": ["asphalt", "aggregate", "macro", "road", "prototype", "cc0"],
  "createdAt": "2026-08-01",
  "updatedAt": "2026-08-01"
}
