{
  "id": "MAT-ASPHALT-0001",
  "name": "Dark Weathered Asphalt",
  "category": "asphalt",
  "subcategory": "weathered_road_surface",
  "description": "Dark gray weathered asphalt with fine aggregate, small cracks, and reflective wear.",
  "status": "prototype",
  "sourceType": "user_photograph",
  "sourceFiles": ["source/original-photo.jpg", "source/crop-source.jpg"],
  "license": "CC0-1.0",
  "provenance": { "creator": "user-provided photograph", "collectionMethod": "phone photograph", "sourcePhoto": "1-Photo-1.jpg", "licenseStatus": "confirmed_by_user" },
  "realWorldWidthMeters": 1,
  "realWorldHeightMeters": 1,
  "scaleStatus": "unverified",
  "pixelsPerMeter": 2048,
  "defaultRepeat": [1, 1],
  "mappingMethods": ["uv", "planar", "box", "triplanar"],
  "baseColorMap": "maps/base-color.jpg",
  "normalMap": null,
  "roughnessMap": null,
  "heightMap": null,
  "aoMap": null,
  "metalnessMap": null,
  "opacityMap": null,
  "roughness": 0.88,
  "metalness": 0,
  "normalStrength": 1,
  "heightStrength": 0.1,
  "displacementScale": 0,
  "colorSpace": "sRGB",
  "seamless": false,
  "tileabilityScore": 0.32,
  "physicalScaleValidated": false,
  "closeupValidated": false,
  "curvedSurfaceValidated": false,
  "verticalSurfaceValidated": false,
  "antiTilingEnabled": false,
  "variants": [],
  "tags": ["asphalt", "road", "aggregate", "weathered", "prototype", "cc0"],
  "createdAt": "2026-08-01",
  "updatedAt": "2026-08-01"
}
