{
  "id": "MAT-CONCRETE-0003",
  "name": "Concrete Pavers A",
  "category": "concrete",
  "subcategory": "paver_grid",
  "description": "Gray and warm concrete pavers with dark joints and subtle surface wear.",
  "status": "prototype",
  "sourceType": "user_photograph",
  "sourceFiles": ["source/original-photo.jpg", "source/crop-source.jpg"],
  "license": "provisional_user_authored",
  "provenance": { "creator": "user-provided photograph", "collectionMethod": "phone photograph", "sourcePhoto": "4-Photo-4.jpg", "licenseStatus": "pending_user_confirmation" },
  "realWorldWidthMeters": 1,
  "realWorldHeightMeters": 1,
  "scaleStatus": "unverified",
  "pixelsPerMeter": 2048,
  "defaultRepeat": [1, 1],
  "mappingMethods": ["uv", "planar", "box", "triplanar"],
  "baseColorMap": "maps/base-color.jpg",
  "normalMap": null,
  "roughnessMap": null,
  "heightMap": null,
  "aoMap": null,
  "metalnessMap": null,
  "opacityMap": null,
  "roughness": 0.9,
  "metalness": 0,
  "normalStrength": 1,
  "heightStrength": 0.08,
  "displacementScale": 0,
  "colorSpace": "sRGB",
  "seamless": false,
  "tileabilityScore": 0.3,
  "physicalScaleValidated": false,
  "closeupValidated": false,
  "curvedSurfaceValidated": false,
  "verticalSurfaceValidated": false,
  "antiTilingEnabled": false,
  "variants": [],
  "tags": ["concrete", "pavers", "joints", "masonry", "prototype"],
  "createdAt": "2026-08-01",
  "updatedAt": "2026-08-01"
}
