{
  "id": "MAT-ASPHALT-0002",
  "name": "Parking Lot Asphalt",
  "category": "asphalt",
  "subcategory": "parking_lot_surface",
  "description": "Smoother dark parking-lot asphalt with the contextual painted line and vehicles excluded from the runtime crop.",
  "status": "prototype",
  "sourceType": "user_photograph",
  "sourceFiles": ["source/original-photo.jpg", "source/crop-source.jpg"],
  "license": "CC0-1.0",
  "provenance": { "creator": "user-provided photograph", "collectionMethod": "phone photograph", "sourcePhoto": "2-Photo-2.jpg", "licenseStatus": "confirmed_by_user" },
  "realWorldWidthMeters": 1,
  "realWorldHeightMeters": 1,
  "scaleStatus": "unverified",
  "pixelsPerMeter": 2048,
  "defaultRepeat": [1, 1],
  "mappingMethods": ["uv", "planar", "box", "triplanar"],
  "baseColorMap": "maps/base-color.jpg",
  "normalMap": null,
  "roughnessMap": null,
  "heightMap": null,
  "aoMap": null,
  "metalnessMap": null,
  "opacityMap": null,
  "roughness": 0.84,
  "metalness": 0,
  "normalStrength": 1,
  "heightStrength": 0.06,
  "displacementScale": 0,
  "colorSpace": "sRGB",
  "seamless": false,
  "tileabilityScore": 0.36,
  "physicalScaleValidated": false,
  "closeupValidated": false,
  "curvedSurfaceValidated": false,
  "verticalSurfaceValidated": false,
  "antiTilingEnabled": false,
  "variants": [],
  "tags": ["asphalt", "parking-lot", "road", "fine-aggregate", "prototype", "cc0"],
  "createdAt": "2026-08-01",
  "updatedAt": "2026-08-01"
}
