{
  "id": "MAT-BRICK-0003",
  "name": "Rough Tan Brick Pavers",
  "category": "brick",
  "subcategory": "rough_masonry_paver",
  "description": "Rough tan brick or masonry pavers separated by dark aggregate joints.",
  "status": "prototype",
  "sourceType": "user_photograph",
  "sourceFiles": ["source/original-photo.jpg", "source/crop-source.jpg"],
  "license": "provisional_user_authored",
  "provenance": { "creator": "user-provided photograph", "collectionMethod": "phone photograph", "sourcePhoto": "10-Photo-10.jpg", "licenseStatus": "pending_user_confirmation" },
  "realWorldWidthMeters": 1,
  "realWorldHeightMeters": 1,
  "scaleStatus": "unverified",
  "pixelsPerMeter": 2048,
  "defaultRepeat": [1, 1],
  "mappingMethods": ["uv", "planar", "box", "triplanar"],
  "baseColorMap": "maps/base-color.jpg",
  "normalMap": null,
  "roughnessMap": null,
  "heightMap": null,
  "aoMap": null,
  "metalnessMap": null,
  "opacityMap": null,
  "roughness": 0.88,
  "metalness": 0,
  "normalStrength": 1,
  "heightStrength": 0.16,
  "displacementScale": 0,
  "colorSpace": "sRGB",
  "seamless": false,
  "tileabilityScore": 0.22,
  "physicalScaleValidated": false,
  "closeupValidated": false,
  "curvedSurfaceValidated": false,
  "verticalSurfaceValidated": false,
  "antiTilingEnabled": false,
  "variants": [],
  "tags": ["brick", "masonry", "rough", "pavers", "prototype"],
  "createdAt": "2026-08-01",
  "updatedAt": "2026-08-01"
}
