{
  "id": "MAT-STONE-0001",
  "name": "Pale Weathered Pavers",
  "category": "stone",
  "subcategory": "weathered_paver_grid",
  "description": "Pale gray stone or concrete paver field with cloudy mineral variation and dark joints.",
  "status": "prototype",
  "sourceType": "user_photograph",
  "sourceFiles": ["source/original-photo.jpg", "source/alternate-photo.jpg", "source/crop-source.jpg"],
  "license": "CC0-1.0",
  "provenance": { "creator": "user-provided photographs", "collectionMethod": "phone photographs", "sourcePhoto": "6-Photo-6.jpg", "sourcePhotos": ["6-Photo-6.jpg", "7-Photo-6.jpg"], "licenseStatus": "confirmed_by_user" },
  "realWorldWidthMeters": 1,
  "realWorldHeightMeters": 1,
  "scaleStatus": "unverified",
  "pixelsPerMeter": 2048,
  "defaultRepeat": [1, 1],
  "mappingMethods": ["uv", "planar", "box", "triplanar"],
  "baseColorMap": "maps/base-color.jpg",
  "normalMap": null,
  "roughnessMap": null,
  "heightMap": null,
  "aoMap": null,
  "metalnessMap": null,
  "opacityMap": null,
  "roughness": 0.82,
  "metalness": 0,
  "normalStrength": 1,
  "heightStrength": 0.08,
  "displacementScale": 0,
  "colorSpace": "sRGB",
  "seamless": false,
  "tileabilityScore": 0.34,
  "physicalScaleValidated": false,
  "closeupValidated": false,
  "curvedSurfaceValidated": false,
  "verticalSurfaceValidated": false,
  "antiTilingEnabled": false,
  "variants": [],
  "tags": ["stone", "pavers", "mineral", "joints", "prototype", "cc0"],
  "createdAt": "2026-08-01",
  "updatedAt": "2026-08-01"
}
