{
  "id": "MAT-BRICK-0001",
  "name": "Weathered Tan Brick Wall",
  "category": "brick",
  "subcategory": "clay_masonry",
  "description": "Phone photograph of a weathered tan brick wall with visible mortar joints.",
  "status": "prototype",
  "sourceType": "user_photograph",
  "sourceFiles": [
    "source/original-photo.jpg",
    "source/crop-source.jpg"
  ],
  "license": "provisional_user_authored",
  "provenance": {
    "creator": "user-provided photograph",
    "collectionMethod": "phone photograph",
    "sourcePhoto": "9-Photo-9.jpg",
    "licenseStatus": "pending_user_confirmation",
    "note": "The source is preserved, but public asset licensing is not yet confirmed."
  },
  "realWorldWidthMeters": 1,
  "realWorldHeightMeters": 1,
  "scaleStatus": "unverified",
  "pixelsPerMeter": 2048,
  "defaultRepeat": [1, 1],
  "mappingMethods": ["uv", "planar", "box", "triplanar"],
  "baseColorMap": "maps/base-color.jpg",
  "normalMap": null,
  "roughnessMap": null,
  "heightMap": null,
  "aoMap": null,
  "metalnessMap": null,
  "opacityMap": null,
  "roughness": 0.86,
  "metalness": 0,
  "normalStrength": 1,
  "heightStrength": 0.12,
  "displacementScale": 0,
  "colorSpace": "sRGB",
  "seamless": false,
  "tileabilityScore": 0.48,
  "physicalScaleValidated": false,
  "closeupValidated": false,
  "curvedSurfaceValidated": false,
  "verticalSurfaceValidated": false,
  "antiTilingEnabled": false,
  "variants": [],
  "tags": ["brick", "mortar", "wall", "weathered", "prototype"],
  "createdAt": "2026-08-01",
  "updatedAt": "2026-08-01"
}
