{
  "id": "MAT-BRICK-0002",
  "name": "Red Brick Pavers",
  "category": "brick",
  "subcategory": "red_paver_grid",
  "description": "Red and brown brick pavers with dark joints, wear, and strong sun variation.",
  "status": "prototype",
  "sourceType": "user_photograph",
  "sourceFiles": ["source/original-photo.jpg", "source/crop-source.jpg"],
  "license": "provisional_user_authored",
  "provenance": { "creator": "user-provided photograph", "collectionMethod": "phone photograph", "sourcePhoto": "8-Photo-8.jpg", "licenseStatus": "pending_user_confirmation" },
  "realWorldWidthMeters": 1,
  "realWorldHeightMeters": 1,
  "scaleStatus": "unverified",
  "pixelsPerMeter": 2048,
  "defaultRepeat": [1, 1],
  "mappingMethods": ["uv", "planar", "box", "triplanar"],
  "baseColorMap": "maps/base-color.jpg",
  "normalMap": null,
  "roughnessMap": null,
  "heightMap": null,
  "aoMap": null,
  "metalnessMap": null,
  "opacityMap": null,
  "roughness": 0.84,
  "metalness": 0,
  "normalStrength": 1,
  "heightStrength": 0.1,
  "displacementScale": 0,
  "colorSpace": "sRGB",
  "seamless": false,
  "tileabilityScore": 0.26,
  "physicalScaleValidated": false,
  "closeupValidated": false,
  "curvedSurfaceValidated": false,
  "verticalSurfaceValidated": false,
  "antiTilingEnabled": false,
  "variants": [],
  "tags": ["brick", "pavers", "red-brick", "joints", "prototype"],
  "createdAt": "2026-08-01",
  "updatedAt": "2026-08-01"
}
