{
  "id": "MAT-CONCRETE-0001",
  "name": "Concrete Pebble",
  "category": "concrete",
  "subcategory": "exposed_aggregate",
  "description": "Photographed sidewalk aggregate surface.",
  "status": "prototype",
  "sourceType": "user_photograph",
  "sourceFiles": [
    "source/original-photo.jpg",
    "source/crop-source.jpg"
  ],
  "license": "CC0-1.0",
  "provenance": {
    "creator": "user-provided photograph",
    "collectionMethod": "phone photograph",
    "note": "The owner has released this user-authored source under CC0-1.0; dimensions remain provisional."
  },
  "realWorldWidthMeters": 1,
  "realWorldHeightMeters": 1,
  "scaleStatus": "unverified",
  "pixelsPerMeter": 2048,
  "defaultRepeat": [1, 1],
  "mappingMethods": ["uv", "planar", "box", "triplanar"],
  "baseColorMap": "maps/base-color.jpg",
  "normalMap": null,
  "roughnessMap": null,
  "heightMap": null,
  "aoMap": null,
  "metalnessMap": null,
  "opacityMap": null,
  "roughness": 0.94,
  "metalness": 0,
  "normalStrength": 1,
  "heightStrength": 0.07,
  "displacementScale": 0,
  "colorSpace": "sRGB",
  "seamless": false,
  "tileabilityScore": 0.22,
  "physicalScaleValidated": false,
  "closeupValidated": false,
  "curvedSurfaceValidated": false,
  "verticalSurfaceValidated": false,
  "antiTilingEnabled": false,
  "variants": [],
  "tags": ["sidewalk", "aggregate", "concrete", "prototype"],
  "createdAt": "2026-08-01",
  "updatedAt": "2026-08-01"
}
